{
  "$schema": "http://json-schema.org/draft-07/schema#",
  "$id": "https://outpost.pub/schemas/theme.schema.json",
  "title": "Outpost Theme",
  "description": "Schema for Outpost CMS theme.json files. Validates theme metadata and optional customizer configuration.",
  "type": "object",
  "required": ["name", "version", "author"],
  "properties": {
    "$schema": {
      "type": "string",
      "description": "JSON Schema reference for IDE validation and autocomplete."
    },
    "name": {
      "type": "string",
      "description": "Display name shown in the admin theme browser. Does not need to match the directory slug.",
      "minLength": 1
    },
    "version": {
      "type": "string",
      "description": "Semantic version string (e.g. \"1.0.0\"). Displayed as a badge on the theme card.",
      "minLength": 1
    },
    "author": {
      "type": "string",
      "description": "Theme creator name. Shown in the theme details panel.",
      "minLength": 1
    },
    "description": {
      "type": "string",
      "description": "A short summary of the theme's purpose and style. Shown beneath the theme name in the browser."
    },
    "screenshot": {
      "type": "string",
      "description": "Filename or relative path of a preview image within the theme directory (PNG or JPG)."
    },
    "managed": {
      "type": "boolean",
      "description": "When true, marks this theme as managed by Outpost. Managed themes receive automatic updates. Do not set this on custom themes.",
      "default": false
    },
    "customizer": {
      "type": "object",
      "description": "Declares customizable properties for the visual Theme Customizer (Admin > Customize).",
      "required": ["sections"],
      "properties": {
        "sections": {
          "type": "array",
          "description": "Each section becomes a tab in the customizer UI.",
          "items": {
            "type": "object",
            "required": ["id", "label", "fields"],
            "properties": {
              "id": {
                "type": "string",
                "description": "Unique identifier for this section (e.g. \"colors\", \"typography\").",
                "minLength": 1
              },
              "label": {
                "type": "string",
                "description": "Display label shown as the section tab name.",
                "minLength": 1
              },
              "fields": {
                "type": "array",
                "description": "Customizable fields within this section.",
                "items": {
                  "type": "object",
                  "required": ["key", "label", "type"],
                  "properties": {
                    "key": {
                      "type": "string",
                      "description": "Unique key for storing/retrieving this field's value (e.g. \"color-accent\").",
                      "minLength": 1
                    },
                    "label": {
                      "type": "string",
                      "description": "Display label shown next to the field in the customizer.",
                      "minLength": 1
                    },
                    "type": {
                      "type": "string",
                      "description": "Field type that determines the UI control.",
                      "enum": ["color", "font", "image", "text", "toggle"]
                    },
                    "default": {
                      "description": "Default value for this field. Type depends on the field type (hex string for color, font name for font, boolean for toggle, string for text)."
                    },
                    "var": {
                      "type": "string",
                      "description": "CSS custom property name to override (e.g. \"--color-accent\"). Used by color and font fields.",
                      "pattern": "^--"
                    }
                  },
                  "additionalProperties": false
                }
              }
            },
            "additionalProperties": false
          }
        }
      },
      "additionalProperties": false
    }
  },
  "additionalProperties": false
}
